{
  "play": "17-ai-observability",
  "version": "1.0.0",
  "context": {
    "knowledge": [
      "T3-Production-Patterns",
      "O5-AI-Infrastructure"
    ],
    "waf": [
      "operational-excellence",
      "reliability",
      "cost-optimization"
    ],
    "scope": "ai-observability-solution"
  },
  "primitives": {
    "agents": [
      "./.github/agents/builder.agent.md",
      "./.github/agents/reviewer.agent.md",
      "./.github/agents/tuner.agent.md"
    ],
    "instructions": [
      "./.github/instructions/ai-observability-patterns.instructions.md",
      "./.github/instructions/azure-coding.instructions.md",
      "./.github/instructions/security.instructions.md"
    ],
    "skills": [
      "./.github/skills/deploy-ai-observability/",
      "./.github/skills/evaluate-ai-observability/",
      "./.github/skills/tune-ai-observability/"
    ],
    "hooks": [
      "../../hooks/fai-secrets-scanner/",
      "../../hooks/fai-tool-guardian/",
      "../../hooks/fai-governance-audit/"
    ],
    "guardrails": {
      "groundedness": 0.85,
      "coherence": 0.8,
      "relevance": 0.8,
      "safety": 0,
      "costPerQuery": 0.05
    }
  },
  "infrastructure": {
    "bicep": "./infra/main.bicep",
    "parameters": "./infra/parameters.json"
  },
  "toolkit": {
    "devkit": ".github/",
    "tunekit": "config/",
    "speckit": "spec/"
  }
}
