{
  "play": "66-ai-infrastructure-optimizer",
  "version": "1.0.0",
  "context": {
    "knowledge": [
      "T3-Production-Patterns",
      "O5-AI-Infrastructure",
      "F2-LLM-Landscape"
    ],
    "waf": [
      "cost-optimization",
      "performance-efficiency",
      "reliability",
      "operational-excellence",
      "security"
    ],
    "scope": "ai-infrastructure-optimizer-solution"
  },
  "primitives": {
    "agents": [
      "./.github/agents/builder.agent.md",
      "./.github/agents/reviewer.agent.md",
      "./.github/agents/tuner.agent.md"
    ],
    "instructions": [
      "./.github/instructions/ai-infrastructure-optimizer-patterns.instructions.md"
    ],
    "skills": [
      "./.github/skills/deploy-ai-infrastructure-optimizer/",
      "./.github/skills/evaluate-ai-infrastructure-optimizer/",
      "./.github/skills/tune-ai-infrastructure-optimizer/"
    ],
    "hooks": [
      "../../hooks/fai-secrets-scanner/",
      "../../hooks/fai-tool-guardian/",
      "../../hooks/fai-governance-audit/"
    ],
    "guardrails": {
      "groundedness": 0.85,
      "coherence": 0.8,
      "relevance": 0.8,
      "safety": 0,
      "costPerQuery": 0.05
    }
  },
  "infrastructure": {
    "bicep": "./infra/main.bicep",
    "parameters": "./infra/parameters.json"
  },
  "toolkit": {
    "devkit": ".github/",
    "tunekit": "config/",
    "speckit": "spec/"
  }
}
