{
  "play": "56-semantic-code-search",
  "version": "1.0.0",
  "context": {
    "knowledge": [
      "R2-RAG-Architecture",
      "F1-GenAI-Foundations",
      "O3-MCP-Tools-Functions"
    ],
    "waf": [
      "security",
      "performance-efficiency",
      "reliability",
      "operational-excellence"
    ],
    "scope": "semantic-code-search-solution"
  },
  "primitives": {
    "agents": [
      "./.github/agents/builder.agent.md",
      "./.github/agents/reviewer.agent.md",
      "./.github/agents/tuner.agent.md"
    ],
    "instructions": [
      "./.github/instructions/semantic-code-search-patterns.instructions.md"
    ],
    "skills": [
      "./.github/skills/deploy-semantic-code-search/",
      "./.github/skills/evaluate-semantic-code-search/",
      "./.github/skills/tune-semantic-code-search/"
    ],
    "hooks": [
      "../../hooks/fai-secrets-scanner/",
      "../../hooks/fai-tool-guardian/",
      "../../hooks/fai-governance-audit/"
    ],
    "guardrails": {
      "groundedness": 0.85,
      "coherence": 0.8,
      "relevance": 0.8,
      "safety": 0,
      "costPerQuery": 0.05
    }
  },
  "infrastructure": {
    "bicep": "./infra/main.bicep",
    "parameters": "./infra/parameters.json"
  },
  "toolkit": {
    "devkit": ".github/",
    "tunekit": "config/",
    "speckit": "spec/"
  }
}
