{
  "play": "07-multi-agent-service",
  "version": "1.0.0",
  "context": {
    "knowledge": [
      "O2-AI-Agents",
      "O1-Semantic-Kernel"
    ],
    "waf": [
      "security",
      "reliability",
      "cost-optimization",
      "performance-efficiency"
    ],
    "scope": "multi-agent-service-solution"
  },
  "primitives": {
    "agents": [
      "./.github/agents/builder.agent.md",
      "./.github/agents/reviewer.agent.md",
      "./.github/agents/tuner.agent.md"
    ],
    "instructions": [
      "./.github/instructions/azure-coding.instructions.md",
      "./.github/instructions/multi-agent-service-patterns.instructions.md",
      "./.github/instructions/security.instructions.md"
    ],
    "skills": [
      "./.github/skills/deploy-multi-agent-service/",
      "./.github/skills/evaluate-multi-agent-service/",
      "./.github/skills/tune-multi-agent-service/"
    ],
    "hooks": [
      "../../hooks/fai-secrets-scanner/",
      "../../hooks/fai-tool-guardian/",
      "../../hooks/fai-governance-audit/"
    ],
    "guardrails": {
      "groundedness": 0.85,
      "coherence": 0.8,
      "relevance": 0.8,
      "safety": 0,
      "costPerQuery": 0.05
    }
  },
  "infrastructure": {
    "bicep": "./infra/main.bicep",
    "parameters": "./infra/parameters.json"
  },
  "toolkit": {
    "devkit": ".github/",
    "tunekit": "config/",
    "speckit": "spec/"
  }
}
