{
  "play": "40-copilot-studio-advanced",
  "version": "1.0.0",
  "context": {
    "knowledge": [
      "F4-GitHub-Agentic-OS",
      "O6-Copilot-Ecosystem",
      "O3-MCP-Tools-Functions"
    ],
    "waf": [
      "security",
      "reliability",
      "operational-excellence",
      "responsible-ai"
    ],
    "scope": "copilot-studio-advanced-solution"
  },
  "primitives": {
    "agents": [
      "./.github/agents/builder.agent.md",
      "./.github/agents/reviewer.agent.md",
      "./.github/agents/tuner.agent.md"
    ],
    "instructions": [
      "./.github/instructions/copilot-studio-advanced-patterns.instructions.md"
    ],
    "skills": [
      "./.github/skills/deploy-copilot-studio-advanced/",
      "./.github/skills/evaluate-copilot-studio-advanced/",
      "./.github/skills/tune-copilot-studio-advanced/"
    ],
    "hooks": [
      "../../hooks/fai-secrets-scanner/",
      "../../hooks/fai-tool-guardian/",
      "../../hooks/fai-governance-audit/"
    ],
    "guardrails": {
      "groundedness": 0.85,
      "coherence": 0.8,
      "relevance": 0.8,
      "safety": 0,
      "costPerQuery": 0.05
    }
  },
  "infrastructure": {
    "bicep": "./infra/main.bicep",
    "parameters": "./infra/parameters.json"
  },
  "toolkit": {
    "devkit": ".github/",
    "tunekit": "config/",
    "speckit": "spec/"
  }
}
