{
  "play": "39-ai-meeting-assistant",
  "version": "1.0.0",
  "context": {
    "knowledge": [
      "F1-GenAI-Foundations",
      "O2-AI-Agents",
      "T2-Responsible-AI"
    ],
    "waf": [
      "security",
      "reliability",
      "responsible-ai",
      "cost-optimization"
    ],
    "scope": "ai-meeting-assistant-solution"
  },
  "primitives": {
    "agents": [
      "./.github/agents/builder.agent.md",
      "./.github/agents/reviewer.agent.md",
      "./.github/agents/tuner.agent.md"
    ],
    "instructions": [
      "./.github/instructions/ai-meeting-assistant-patterns.instructions.md"
    ],
    "skills": [
      "./.github/skills/deploy-ai-meeting-assistant/",
      "./.github/skills/evaluate-ai-meeting-assistant/",
      "./.github/skills/tune-ai-meeting-assistant/"
    ],
    "hooks": [
      "../../hooks/fai-secrets-scanner/",
      "../../hooks/fai-tool-guardian/",
      "../../hooks/fai-governance-audit/"
    ],
    "guardrails": {
      "groundedness": 0.85,
      "coherence": 0.8,
      "relevance": 0.8,
      "safety": 0,
      "costPerQuery": 0.05
    }
  },
  "infrastructure": {
    "bicep": "./infra/main.bicep",
    "parameters": "./infra/parameters.json"
  },
  "toolkit": {
    "devkit": ".github/",
    "tunekit": "config/",
    "speckit": "spec/"
  }
}
